{
  "schema_version": 2,
  "languages": [
    "en",
    "vi",
    "ko",
    "zh"
  ],
  "labels": {
    "a_la_carte_dinner": {
      "en": "à-la-carte dinner",
      "vi": "bữa tối gọi món",
      "ko": "알라카르트 디너",
      "zh": "单点晚餐",
      "aliases": {
        "en": [
          "à-la-carte dinner",
          "a la carte dinner"
        ],
        "vi": [
          "bữa tối gọi món",
          "bua toi goi mon"
        ],
        "ko": [
          "알라카르트 디너"
        ],
        "zh": [
          "单点晚餐"
        ]
      }
    },
    "a_la_carte_lunch": {
      "en": "à-la-carte lunch",
      "vi": "bữa trưa gọi món",
      "ko": "알라카르트 런치",
      "zh": "单点午餐",
      "aliases": {
        "en": [
          "à-la-carte lunch",
          "a la carte lunch"
        ],
        "vi": [
          "bữa trưa gọi món",
          "bua trua goi mon"
        ],
        "ko": [
          "알라카르트 런치"
        ],
        "zh": [
          "单点午餐"
        ]
      }
    },
    "accepted_cards": {
      "en": "accepted cards",
      "vi": "thẻ được chấp nhận",
      "ko": "사용 가능한 카드",
      "zh": "可用信用卡",
      "aliases": {
        "en": [
          "accepted cards",
          "credit cards accepted",
          "which cards"
        ],
        "vi": [
          "thẻ được chấp nhận",
          "thẻ tín dụng",
          "quẹt thẻ",
          "the duoc chap nhan",
          "the tin dung",
          "quet the"
        ],
        "ko": [
          "사용 가능한 카드",
          "신용카드"
        ],
        "zh": [
          "可用信用卡",
          "信用卡"
        ]
      }
    },
    "accessible_rooms": {
      "en": "wheelchair-accessible rooms",
      "vi": "phòng cho xe lăn",
      "ko": "휠체어 객실",
      "zh": "无障碍客房",
      "aliases": {
        "en": [
          "wheelchair-accessible rooms",
          "accessible room",
          "wheelchair room"
        ],
        "vi": [
          "phòng cho xe lăn",
          "phòng người khuyết tật",
          "phong cho xe lan",
          "phong nguoi khuyet tat"
        ],
        "ko": [
          "휠체어 객실",
          "장애인 객실"
        ],
        "zh": [
          "无障碍客房",
          "轮椅客房"
        ]
      }
    },
    "adapter_transformer_availability": {
      "en": "Adapter Transformer Availability",
      "vi": "Khả dụng bộ chuyển đổi",
      "ko": "어댑터 이용 가능",
      "zh": "转换插头可用",
      "aliases": {
        "en": [
          "adapter transformer availability"
        ],
        "vi": [
          "khả dụng bộ chuyển đổi",
          "kha dung bo chuyen doi"
        ],
        "ko": [
          "어댑터 이용 가능"
        ],
        "zh": [
          "转换插头可用"
        ]
      }
    },
    "additional_towels": {
      "en": "Additional Towels",
      "vi": "Khăn tắm bổ sung",
      "ko": "추가 수건",
      "zh": "额外毛巾",
      "aliases": {
        "en": [
          "additional towels"
        ],
        "vi": [
          "khăn tắm bổ sung",
          "khan tam bo sung"
        ],
        "ko": [
          "추가 수건"
        ],
        "zh": [
          "额外毛巾"
        ]
      }
    },
    "adult_price": {
      "en": "Adult Price",
      "vi": "Giá người lớn",
      "ko": "성인 요금",
      "zh": "成人价格",
      "aliases": {
        "en": [
          "adult price",
          "adult",
          "adult rate",
          "adult ticket price"
        ],
        "vi": [
          "giá người lớn",
          "gia nguoi lon",
          "người lớn",
          "giá vé người lớn"
        ],
        "ko": [
          "성인 요금",
          "성인",
          "성인 가격"
        ],
        "zh": [
          "成人价格",
          "成人",
          "成人票价"
        ]
      }
    },
    "advance_booking_notice": {
      "en": "Advance Booking Notice",
      "vi": "Thời hạn đặt trước",
      "ko": "사전 예약 안내",
      "zh": "提前预订要求",
      "aliases": {
        "en": [
          "advance booking notice"
        ],
        "vi": [
          "thời hạn đặt trước",
          "thoi han dat truoc"
        ],
        "ko": [
          "사전 예약 안내"
        ],
        "zh": [
          "提前预订要求"
        ]
      }
    },
    "afternoon_tea_dessert_buffet_offer": {
      "en": "Afternoon Tea Dessert Buffet Offer",
      "vi": "Afternoon Tea Dessert Buffet Offer",
      "ko": "Afternoon Tea Dessert Buffet Offer",
      "zh": "Afternoon Tea Dessert Buffet Offer",
      "proper_name": true,
      "aliases": {
        "en": [
          "afternoon tea dessert buffet offer"
        ],
        "vi": [
          "afternoon tea dessert buffet offer"
        ],
        "ko": [
          "Afternoon Tea Dessert Buffet Offer"
        ],
        "zh": [
          "Afternoon Tea Dessert Buffet Offer"
        ]
      }
    },
    "all_rooms_non_smoking": {
      "en": "non-smoking rooms",
      "vi": "phòng không hút thuốc",
      "ko": "금연 객실",
      "zh": "禁烟客房",
      "aliases": {
        "en": [
          "non-smoking rooms",
          "smoking",
          "non smoking"
        ],
        "vi": [
          "phòng không hút thuốc",
          "hút thuốc",
          "phong khong hut thuoc",
          "hut thuoc"
        ],
        "ko": [
          "금연 객실",
          "흡연",
          "금연"
        ],
        "zh": [
          "禁烟客房",
          "吸烟",
          "禁烟"
        ]
      }
    },
    "assistance_scope": {
      "en": "services offered",
      "vi": "phạm vi hỗ trợ",
      "ko": "지원 범위",
      "zh": "服务范围",
      "aliases": {
        "en": [
          "services offered",
          "what can concierge do"
        ],
        "vi": [
          "phạm vi hỗ trợ",
          "hỗ trợ những gì",
          "pham vi ho tro",
          "ho tro nhung gi"
        ],
        "ko": [
          "지원 범위",
          "도움 범위"
        ],
        "zh": [
          "服务范围",
          "能帮什么"
        ]
      }
    },
    "availability": {
      "en": "Availability",
      "vi": "Tình trạng sẵn có",
      "ko": "이용 가능 여부",
      "zh": "可用情况",
      "aliases": {
        "en": [
          "availability",
          "available",
          "is it available"
        ],
        "vi": [
          "tình trạng sẵn có",
          "tinh trang san co",
          "còn không",
          "có sẵn không",
          "có không",
          "khả dụng"
        ],
        "ko": [
          "이용 가능 여부",
          "이용 가능",
          "가능한가요"
        ],
        "zh": [
          "可用情况",
          "有吗",
          "可用吗",
          "是否提供"
        ]
      }
    },
    "balcony_area": {
      "en": "Balcony Area",
      "vi": "Diện tích ban công",
      "ko": "발코니 면적",
      "zh": "阳台面积",
      "redundant_with_label": true,
      "aliases": {
        "en": [
          "balcony area"
        ],
        "vi": [
          "diện tích ban công",
          "dien tich ban cong"
        ],
        "ko": [
          "발코니 면적"
        ],
        "zh": [
          "阳台面积"
        ]
      }
    },
    "balcony_door_auto_off": {
      "en": "switches off when balcony door opens",
      "vi": "tự tắt khi mở cửa ban công",
      "ko": "발코니 문 열면 자동 꺼짐",
      "zh": "阳台门打开时自动关闭",
      "aliases": {
        "en": [
          "switches off when balcony door opens",
          "balcony door"
        ],
        "vi": [
          "tự tắt khi mở cửa ban công",
          "cửa ban công",
          "tu tat khi mo cua ban cong",
          "cua ban cong"
        ],
        "ko": [
          "발코니 문 열면 자동 꺼짐",
          "발코니 문"
        ],
        "zh": [
          "阳台门打开时自动关闭",
          "阳台门"
        ]
      }
    },
    "banquet": {
      "en": "banquet",
      "vi": "tiệc",
      "ko": "연회",
      "zh": "宴会",
      "aliases": {
        "en": [
          "banquet",
          "banquet style",
          "banquet seating"
        ],
        "vi": [
          "tiệc",
          "tiec",
          "kiểu tiệc",
          "bố trí tiệc"
        ],
        "ko": [
          "연회",
          "연회식",
          "연회 배치"
        ],
        "zh": [
          "宴会",
          "宴会式",
          "宴会摆台"
        ]
      }
    },
    "beach_length": {
      "en": "Beach Length",
      "vi": "Chiều dài bãi biển",
      "ko": "해변 길이",
      "zh": "海滩长度",
      "aliases": {
        "en": [
          "beach length"
        ],
        "vi": [
          "chiều dài bãi biển",
          "chieu dai bai bien"
        ],
        "ko": [
          "해변 길이"
        ],
        "zh": [
          "海滩长度"
        ]
      }
    },
    "beachfront_private_pool": {
      "en": "beachfront with private pool",
      "vi": "sát biển có hồ bơi riêng",
      "ko": "해변 앞 전용 수영장",
      "zh": "海滨私人泳池",
      "aliases": {
        "en": [
          "beachfront with private pool",
          "private pool",
          "beach access"
        ],
        "vi": [
          "sát biển có hồ bơi riêng",
          "hồ bơi riêng",
          "sat bien co ho boi rieng",
          "ho boi rieng"
        ],
        "ko": [
          "해변 앞 전용 수영장",
          "전용 수영장"
        ],
        "zh": [
          "海滨私人泳池",
          "私人泳池"
        ]
      }
    },
    "bed_configuration": {
      "en": "Bed Configuration",
      "vi": "Bố trí giường",
      "ko": "침대 구성",
      "zh": "床铺配置",
      "aliases": {
        "en": [
          "bed configuration"
        ],
        "vi": [
          "bố trí giường",
          "bo tri giuong"
        ],
        "ko": [
          "침대 구성"
        ],
        "zh": [
          "床铺配置"
        ]
      }
    },
    "bedroom_availability": {
      "en": "available in each bedroom",
      "vi": "có trong mỗi phòng ngủ",
      "ko": "각 침실 비치",
      "zh": "每间卧室提供",
      "aliases": {
        "en": [
          "available in each bedroom",
          "in the bedroom"
        ],
        "vi": [
          "có trong mỗi phòng ngủ",
          "trong phòng ngủ",
          "co trong moi phong ngu",
          "trong phong ngu"
        ],
        "ko": [
          "각 침실 비치",
          "침실"
        ],
        "zh": [
          "每间卧室提供",
          "卧室"
        ]
      }
    },
    "boardroom": {
      "en": "boardroom",
      "vi": "phòng họp",
      "ko": "회의실",
      "zh": "董事会会议室",
      "aliases": {
        "en": [
          "boardroom"
        ],